{
  "id": "huaqiao-wuliande-wanguo-001",
  "title": "万国鼠疫研究会议",
  "source": {
    "work": "中国侨网《90年前，他成为首位获诺贝尔奖提名的华人》",
    "url": "http://www.chinaqw.com.cn/ycjx/2025/03-11/391062.shtml",
    "revision": "2025-03-11",
    "quotes": [
      "在1911年4月的“万国鼠疫研究会议”上，伍连德被推举为大会主席。会议同时建议中国政府在东三省设立永久性防疫机构，以防瘟疫卷土重来。",
      "1912年11月，中国第一个常设防疫机构“东三省防疫事务总管理处”在哈尔滨成立，伍连德出任总办兼总医官。他在东北筹建了多所医院和实验室，平时应诊，疫时防治。"
    ]
  },
  "fields": {
    "人物": {
      "text": "伍连德，东三省防疫总医官。",
      "evidence": "伍连德出任总办兼总医官",
      "inferred": false
    },
    "时间": {
      "text": "1911年4月。",
      "evidence": "在1911年4月的“万国鼠疫研究会议”上",
      "inferred": false
    },
    "地点": {
      "text": "奉天。",
      "evidence": null,
      "inferred": true
    },
    "起因": {
      "text": "东北鼠疫平息后，各国医学专家开会总结防疫经验。",
      "evidence": null,
      "inferred": true
    },
    "经过": {
      "text": "伍连德在会上被推举为大会主席。",
      "evidence": "伍连德被推举为大会主席",
      "inferred": false
    },
    "结果": {
      "text": "会议建议中国在东三省设立永久性防疫机构。",
      "evidence": "会议同时建议中国政府在东三省设立永久性防疫机构",
      "inferred": false
    }
  },
  "notes": "会议地点为奉天（今沈阳），本文未载，据核查报告补。",
  "review": {
    "status": "draft",
    "by": null,
    "at": null
  }
}