{
  "id": "huaqiao-zhangbishi-chuyang-001",
  "title": "只身出洋谋生",
  "source": {
    "work": "烟台市芝罘区人民政府《张弼士》",
    "url": "https://www.zhifu.gov.cn/art/2023/5/18/art_51893_1989741.html",
    "revision": "2023-05-18",
    "quotes": [
      "(1840～1916)名振勋，原名肇燮，字弼士，广东省大埔县人。烟台张裕葡萄酒公司创始人",
      "幼时因家贫，随父读书三年即辍学。1856年只身飘洋过海，到荷兰巴达维亚(今印度尼西亚雅加达)，在一家纸行当学徒，后独立经营酒类商行，并获准承包酒税、典当税及一些地区的鸦片烟税，财富日增。",
      "1892年(光绪十八年)，投资300万元，创办烟台张裕葡萄酿酒公司，为当时规模最大的一家现代化工业企业，同时在市郊购得荒山两座，雇工千余，建设葡萄园近千亩，种植葡萄25万株，124个品种",
      "1915年，在美国旧金山举行的巴拿马国际商品赛会上，张裕葡萄酿酒公司生产的白兰地、红葡萄、琼瑶浆酒均获最优等奖状和金质奖章",
      "1916年，张弼士重返南洋，因筹办银行事务，积劳成疾，于9月12日在印度尼西亚巴城逝世，享年76岁。",
      "棺木经新加坡、香港、汕头运回原籍大埔安葬，所经各地，荷、美政府均下半旗致哀。",
      "张弼士重视振兴国内实业"
    ]
  },
  "fields": {
    "人物": {
      "text": "张弼士，广东大埔人，实业家。",
      "evidence": "广东省大埔县人",
      "inferred": false
    },
    "时间": {
      "text": "1856年。",
      "evidence": "1856年只身飘洋过海",
      "inferred": false
    },
    "地点": {
      "text": "巴达维亚。",
      "evidence": "到荷兰巴达维亚(今印度尼西亚雅加达)",
      "inferred": false
    },
    "起因": {
      "text": "幼时家贫，随父读书三年即辍学。",
      "evidence": "幼时因家贫，随父读书三年即辍学",
      "inferred": false
    },
    "经过": {
      "text": "张弼士只身漂洋过海到巴达维亚，在一家纸行当学徒。",
      "evidence": "1856年只身飘洋过海，到荷兰巴达维亚(今印度尼西亚雅加达)，在一家纸行当学徒",
      "inferred": false
    },
    "结果": {
      "text": "后来他独立经营酒类商行，获准承包酒税，财富日增。",
      "evidence": "后独立经营酒类商行，并获准承包酒税、典当税及一些地区的鸦片烟税，财富日增",
      "inferred": false
    }
  },
  "notes": "",
  "review": {
    "status": "draft",
    "by": null,
    "at": null
  }
}