{
  "id": "huaqiao-huwenhu-xuanchuan-001",
  "title": "组织抗日宣传队",
  "source": {
    "work": "中新社《支援祖国抗战的闽西爱国侨领》",
    "url": "https://www.chinaqw.com/gqqj/2015/08-17/60817.shtml",
    "revision": "2015-08-17",
    "quotes": [
      "八年抗战期间，胡文虎个人捐助现金逾3000万元，并号召海外华人华侨捐资过亿。",
      "为了把日本仁丹挤出中国市场，胡文虎组织五个“永安堂抗日宣传队”，赶排了一批表现抗日内容的话剧、歌舞，深入四川一百个县乡表演宣传。通过此次宣传，深得民心，胡文虎的名声响遍四川，虎标成药迅速风行巴山蜀水，取代了日本的仁丹。",
      "从1913年至1952年，他先后办起了10多家报纸，各报均以星字冠头，组成了他的星系报业王国。在华侨报业史上，星系报业以规模最大、数量最多，又创了一个侨界之最。",
      "“爱国是我的天职，当然要出钱捐助政府抗日。”",
      "中川村是爱国侨领、“万金油大王”胡文虎的故乡。",
      "据《中华民族的抗日战争》一书记载：抗战时期，胡文虎捐赠的财物为华侨之最。"
    ]
  },
  "fields": {
    "人物": {
      "text": "胡文虎，万金油大王。",
      "evidence": "“万金油大王”胡文虎的故乡",
      "inferred": false
    },
    "时间": {
      "text": "抗战爆发后。",
      "evidence": null,
      "inferred": true
    },
    "地点": {
      "text": "四川。",
      "evidence": "深入四川一百个县乡表演宣传",
      "inferred": false
    },
    "起因": {
      "text": "日本仁丹占据四川市场，胡文虎要把日货挤出中国市场。",
      "evidence": "为了把日本仁丹挤出中国市场",
      "inferred": false
    },
    "经过": {
      "text": "他组织五个永安堂抗日宣传队，深入四川一百个县乡演出宣传。",
      "evidence": "胡文虎组织五个“永安堂抗日宣传队”",
      "inferred": false
    },
    "结果": {
      "text": "虎标成药风行四川，取代了日本仁丹。",
      "evidence": "虎标成药迅速风行巴山蜀水，取代了日本的仁丹",
      "inferred": false
    }
  },
  "notes": "",
  "review": {
    "status": "draft",
    "by": null,
    "at": null
  }
}