{
  "id": "huaqiao-chenliushi-xiada-001",
  "title": "捐助厦大基金",
  "source": {
    "work": "厦门市集美区人民政府《人物传·陈六使》",
    "url": "https://www.jimei.gov.cn/F566/qqgk/lsmr/201602/t20160205_1041786.htm",
    "revision": "2016-02-05",
    "quotes": [
      "益和公司很快成为与李光前的南益橡胶公司并执新马胶业牛耳的最大橡胶企业。",
      "1953年1月，六使主持福建会馆执监委会议，倡议创办南洋华文大学，并认捐500万元。",
      "会后，297个华人社团组成南洋大学筹备委员会，推举六使为主席。",
      "福建会馆献出云南园450英亩土地作校址，并捐款60万元建设学校大礼堂。",
      "1956年 3月15日，南洋大学正式开学，六使任学校执行委员会主席",
      "1980年，南洋大学与新加坡大学合并，25年间，为当地培养了成千上万的优秀人才。",
      "民国25年，嘉庚计划集资16万元，购买橡胶园400亩，以其收益充作厦门大学基金，六使捐助5万元。"
    ]
  },
  "fields": {
    "人物": {
      "text": "陈六使，益和橡胶公司经营者。",
      "evidence": "益和公司很快成为与李光前的南益橡胶公司并执新马胶业牛耳的最大橡胶企业",
      "inferred": false
    },
    "时间": {
      "text": "1936年。",
      "evidence": "民国25年，嘉庚计划集资16万元",
      "inferred": false
    },
    "地点": {
      "text": "新加坡。",
      "evidence": null,
      "inferred": true
    },
    "起因": {
      "text": "陈嘉庚计划集资16万元购买橡胶园，以收益充作厦门大学基金。",
      "evidence": "嘉庚计划集资16万元，购买橡胶园400亩，以其收益充作厦门大学基金",
      "inferred": false
    },
    "经过": {
      "text": "陈六使捐助5万元。",
      "evidence": "六使捐助5万元",
      "inferred": false
    },
    "结果": {
      "text": "这笔钱用于购买橡胶园，收益充作厦大基金。",
      "evidence": "购买橡胶园400亩，以其收益充作厦门大学基金",
      "inferred": false
    }
  },
  "notes": "民国25年即1936年，年为公元换算所得。",
  "review": {
    "status": "draft",
    "by": null,
    "at": null
  }
}