{
  "id": "huaqiao-chenliushi-kaixue-001",
  "title": "南洋大学开学",
  "source": {
    "work": "厦门市集美区人民政府《人物传·陈六使》",
    "url": "https://www.jimei.gov.cn/F566/qqgk/lsmr/201602/t20160205_1041786.htm",
    "revision": "2016-02-05",
    "quotes": [
      "益和公司很快成为与李光前的南益橡胶公司并执新马胶业牛耳的最大橡胶企业。",
      "1953年1月，六使主持福建会馆执监委会议，倡议创办南洋华文大学，并认捐500万元。",
      "会后，297个华人社团组成南洋大学筹备委员会，推举六使为主席。",
      "福建会馆献出云南园450英亩土地作校址，并捐款60万元建设学校大礼堂。",
      "1956年 3月15日，南洋大学正式开学，六使任学校执行委员会主席",
      "1980年，南洋大学与新加坡大学合并，25年间，为当地培养了成千上万的优秀人才。",
      "民国25年，嘉庚计划集资16万元，购买橡胶园400亩，以其收益充作厦门大学基金，六使捐助5万元。"
    ]
  },
  "fields": {
    "人物": {
      "text": "陈六使，南洋大学执行委员会主席。",
      "evidence": "六使任学校执行委员会主席",
      "inferred": false
    },
    "时间": {
      "text": "1956年3月15日。",
      "evidence": "1956年 3月15日，南洋大学正式开学",
      "inferred": false
    },
    "地点": {
      "text": "云南园。",
      "evidence": "福建会馆献出云南园450英亩土地作校址",
      "inferred": false
    },
    "起因": {
      "text": "筹备完成后，福建会馆献出云南园土地作校址。",
      "evidence": "福建会馆献出云南园450英亩土地作校址",
      "inferred": false
    },
    "经过": {
      "text": "1956年3月15日，南洋大学正式开学，陈六使任执行委员会主席。",
      "evidence": "1956年 3月15日，南洋大学正式开学，六使任学校执行委员会主席",
      "inferred": false
    },
    "结果": {
      "text": "1980年南洋大学与新加坡大学合并，25年间培养了大批人才。",
      "evidence": "1980年，南洋大学与新加坡大学合并，25年间，为当地培养了成千上万的优秀人才",
      "inferred": false
    }
  },
  "notes": "原文作 1956 年 3 月 15 日开学，与常见的 1955 年说法不同，此处照录原文。",
  "review": {
    "status": "draft",
    "by": null,
    "at": null
  }
}