{
  "id": "huaqiao-chenliushi-nanda-001",
  "title": "倡办南洋大学",
  "source": {
    "work": "厦门市集美区人民政府《人物传·陈六使》",
    "url": "https://www.jimei.gov.cn/F566/qqgk/lsmr/201602/t20160205_1041786.htm",
    "revision": "2016-02-05",
    "quotes": [
      "益和公司很快成为与李光前的南益橡胶公司并执新马胶业牛耳的最大橡胶企业。",
      "1953年1月，六使主持福建会馆执监委会议，倡议创办南洋华文大学，并认捐500万元。",
      "会后，297个华人社团组成南洋大学筹备委员会，推举六使为主席。",
      "福建会馆献出云南园450英亩土地作校址，并捐款60万元建设学校大礼堂。",
      "1956年 3月15日，南洋大学正式开学，六使任学校执行委员会主席",
      "1980年，南洋大学与新加坡大学合并，25年间，为当地培养了成千上万的优秀人才。",
      "民国25年，嘉庚计划集资16万元，购买橡胶园400亩，以其收益充作厦门大学基金，六使捐助5万元。"
    ]
  },
  "fields": {
    "人物": {
      "text": "陈六使，南洋大学筹备委员会主席。",
      "evidence": "推举六使为主席",
      "inferred": false
    },
    "时间": {
      "text": "1953年1月。",
      "evidence": "1953年1月，六使主持福建会馆执监委会议",
      "inferred": false
    },
    "地点": {
      "text": "新加坡。",
      "evidence": null,
      "inferred": true
    },
    "起因": {
      "text": "南洋华人需要一所华文大学，陈六使倡议创办。",
      "evidence": null,
      "inferred": true
    },
    "经过": {
      "text": "他主持福建会馆会议，倡议创办南洋华文大学，并认捐500万元。",
      "evidence": "六使主持福建会馆执监委会议，倡议创办南洋华文大学，并认捐500万元",
      "inferred": false
    },
    "结果": {
      "text": "297个华人社团组成筹备委员会，推举他为主席。",
      "evidence": "297个华人社团组成南洋大学筹备委员会，推举六使为主席",
      "inferred": false
    }
  },
  "notes": "",
  "review": {
    "status": "draft",
    "by": null,
    "at": null
  }
}