{
  "id": "huaqiao-huangnaishang-zhaomu-001",
  "title": "招募垦荒者到诗巫",
  "source": {
    "work": "人民日报海外版《黄乃裳：让中马两国人民感念百年》（中国侨网转载）",
    "url": "https://www.chinaqw.com/sqfg/2018/09-12/201664.shtml",
    "revision": "2018-09-12",
    "quotes": [
      "可以看到著名的华侨领袖、民主革命家、教育家黄乃裳(1849—1924)。他出生于福州府闽清县六都湖峰村(今坂东镇湖头村)",
      "1898年戊戌变法失败后，49岁的黄乃裳遭清政府通缉，返回福建。他发现福建人民生活困难，便计划前往南洋寻觅可以移民垦殖的地方。1899年，黄乃裳举家来到新加坡，到各地勘察移民点。1900年，以“港主”的身份与查尔斯·布鲁克订立垦约，选定今日诗巫郊区新珠山作为垦区",
      "在条约中有“待吾农人与英人一例，所垦之地有九百九十九年之权利",
      "1901—1902年，黄乃裳先后3次共招募1118名垦荒者到达诗巫，命名诗巫为“新福州”。设立“新福州垦场公司(新福州总公司)”；为农工修建住处；兴建五所教堂、一所学校。",
      "4年之后的1904年，黄乃裳将垦场的管理工作托付给美国牧师富雅各，悄然回国。",
      "黄乃裳离开后，富雅各牧师继续带领福州移民垦殖，并引种橡胶"
    ]
  },
  "fields": {
    "人物": {
      "text": "黄乃裳，诗巫垦场港主。",
      "evidence": "以“港主”的身份与查尔斯·布鲁克订立垦约",
      "inferred": false
    },
    "时间": {
      "text": "1901年至1902年。",
      "evidence": "1901—1902年，黄乃裳先后3次共招募1118名垦荒者到达诗巫",
      "inferred": false
    },
    "地点": {
      "text": "诗巫。",
      "evidence": "共招募1118名垦荒者到达诗巫",
      "inferred": false
    },
    "起因": {
      "text": "垦区划定后，需要招募农工前往开垦。",
      "evidence": null,
      "inferred": true
    },
    "经过": {
      "text": "黄乃裳先后三次共招募1118名垦荒者到达诗巫，把那里命名为新福州。",
      "evidence": "先后3次共招募1118名垦荒者到达诗巫，命名诗巫为“新福州”",
      "inferred": false
    },
    "结果": {
      "text": "他设立垦场公司，为农工修建住处，兴建五所教堂和一所学校。",
      "evidence": "设立“新福州垦场公司(新福州总公司)”；为农工修建住处；兴建五所教堂、一所学校",
      "inferred": false
    }
  },
  "notes": "",
  "review": {
    "status": "draft",
    "by": null,
    "at": null
  }
}