{
  "id": "huaqiao-chenjiageng-xiada-001",
  "title": "创办厦门大学",
  "source": {
    "work": "人民网《陈嘉庚生平简介》",
    "url": "https://v.people.cn/n1/2022/0321/c437377-32380050.html",
    "revision": "2022-03-21",
    "quotes": [
      "1874年10月21日，陈嘉庚出生于福建省同安县集美社。1890年，奉父函召，第一次到新加坡佐理商务。1904年，创办新利川菠萝罐头厂，从黄梨罐头加工业入手，独立创办实业，逐步发展壮大。到1925年，陈嘉庚的企业发展达到顶峰，资产达1200万元，被誉为“橡胶大王”，开创了新马民族工业的新纪元。",
      "从1913年起，陈嘉庚在集美创建了包括幼儿园、男女小学、中学、师范、水产、航海、商业、农林等在内的普通教育与职业教育并重、男女学兼备的体系完备的教育机构。陈嘉庚于1921年创办的厦门大学，成为当时全国院系最齐全的五所大学之一，被誉为“南方之强”。",
      "“七七事变”后，他发起组织“新加坡筹赈会”，被推为主席。1938年，他发起组织“南洋华侨筹赈祖国难民总会”（南侨总会）并被推为主席，统领一千万南洋华侨全力支援抗战，为抗战胜利作出巨大贡献。"
    ]
  },
  "fields": {
    "人物": {
      "text": "陈嘉庚，福建同安集美人。",
      "evidence": "陈嘉庚出生于福建省同安县集美社",
      "inferred": false
    },
    "时间": {
      "text": "1921年。",
      "evidence": "陈嘉庚于1921年创办的厦门大学",
      "inferred": false
    },
    "地点": {
      "text": "福建厦门。",
      "evidence": "陈嘉庚于1921年创办的厦门大学",
      "inferred": true
    },
    "起因": {
      "text": "集美办学之后，陈嘉庚决定在福建创办一所大学。",
      "evidence": null,
      "inferred": true
    },
    "经过": {
      "text": "陈嘉庚于1921年创办厦门大学。",
      "evidence": "陈嘉庚于1921年创办的厦门大学",
      "inferred": false
    },
    "结果": {
      "text": "厦门大学成为当时全国院系最齐全的五所大学之一。",
      "evidence": "成为当时全国院系最齐全的五所大学之一",
      "inferred": false
    }
  },
  "notes": "",
  "review": {
    "status": "draft",
    "by": null,
    "at": null
  }
}