{
  "id": "huaqiao-yayalai-chongjian-001",
  "title": "吉隆坡重建",
  "source": {
    "work": "人民日报海外版《华裔叶亚来重建吉隆坡》（中国侨网转载）",
    "url": "https://www.chinaqw.com/zgqj/qsgc/200701/26/59284.shtml",
    "revision": "2007-01-26",
    "quotes": [
      "吉隆坡光复后，雪兰莪州苏丹再次任命叶亚来为吉隆坡华人甲必丹兼吉隆坡行政长官。",
      "首先，他向雪兰莪当局筹措低息贷款，迅速恢复锡矿生产，并安装以蒸汽为动力的抽水机，提高了锡矿的开采率。",
      "随着锡矿渐上轨道，又增添采矿工具维修作坊、采石场、砖瓦厂以及运输锡矿的码头、货船等配套设施。"
    ]
  },
  "fields": {
    "人物": {
      "text": "叶亚来，吉隆坡华人甲必丹兼行政长官。",
      "evidence": "雪兰莪州苏丹再次任命叶亚来为吉隆坡华人甲必丹兼吉隆坡行政长官",
      "inferred": false
    },
    "时间": {
      "text": "1873年后。",
      "evidence": null,
      "inferred": true
    },
    "地点": {
      "text": "吉隆坡。",
      "evidence": "吉隆坡光复后",
      "inferred": false
    },
    "起因": {
      "text": "光复后，雪兰莪苏丹再次任命叶亚来为甲必丹兼行政长官。",
      "evidence": "雪兰莪州苏丹再次任命叶亚来为吉隆坡华人甲必丹兼吉隆坡行政长官",
      "inferred": false
    },
    "经过": {
      "text": "他向雪兰莪当局筹措低息贷款，恢复锡矿生产，安装蒸汽抽水机。",
      "evidence": "他向雪兰莪当局筹措低息贷款，迅速恢复锡矿生产，并安装以蒸汽为动力的抽水机",
      "inferred": false
    },
    "结果": {
      "text": "锡矿恢复后，又增添维修作坊、采石场、砖瓦厂和运输码头。",
      "evidence": "又增添采矿工具维修作坊、采石场、砖瓦厂以及运输锡矿的码头、货船等配套设施",
      "inferred": false
    }
  },
  "notes": "",
  "review": {
    "status": "draft",
    "by": null,
    "at": null
  }
}