{
  "id": "han-caochong-chengxiang",
  "title": "曹冲称象",
  "source": {
    "work": "三国志·魏书·武文世王公传",
    "url": "https://zh.wikisource.org/wiki/三國志/卷20",
    "revision": null,
    "quotes": [
      "邓哀王冲字仓舒。少聪察岐嶷，生五六岁，智意所及，有若成人之智。",
      "时孙权曾致巨象，太祖欲知其斤重，访之群下，咸莫能出其理。冲曰：置象大船之上，而刻其水痕所至，称物以载之，则校可知矣。太祖大悦，即施行焉。"
    ]
  },
  "fields": {
    "人物": {
      "text": "曹冲，字仓舒，五六岁，聪慧如成人；曹操，其父；孙权，江东之主。",
      "evidence": "邓哀王冲字仓舒。少聪察岐嶷，生五六岁，智意所及，有若成人之智。",
      "inferred": false
    },
    "时间": {
      "text": "建安年间。",
      "evidence": null,
      "inferred": true
    },
    "地点": {
      "text": "许都，曹操府中。",
      "evidence": null,
      "inferred": true
    },
    "起因": {
      "text": "孙权送来一头巨象，曹操想知道它有多重，众人都想不出办法。",
      "evidence": "时孙权曾致巨象，太祖欲知其斤重，访之群下，咸莫能出其理。",
      "inferred": false
    },
    "经过": {
      "text": "曹冲让人把象牵上大船，在水痕处刻下记号，再把象牵下来，往船里装石头，装到水痕齐平，然后称石头的重量。",
      "evidence": "置象大船之上，而刻其水痕所至，称物以载之，则校可知矣。",
      "inferred": false
    },
    "结果": {
      "text": "石头称完，象的重量就知道了，曹操大喜，照着做了。",
      "evidence": "太祖大悦，即施行焉。",
      "inferred": false
    }
  },
  "review": {
    "status": "approved",
    "by": "format example",
    "at": "2026-10-28"
  }
}
