{
  "id": "huaqiao-chenjiageng-nanqiao-001",
  "title": "南侨机工回国服务",
  "source": {
    "work": "新华社《南洋华侨机工回国服务团：抗日烽火中的赤子壮歌》（央广网转载）",
    "url": "https://m.cnr.cn/news/20181118/t20181118_524418788.html",
    "revision": "2018-11-18",
    "quotes": [
      "滇缅公路修通后，熟练的司机和技工十分紧缺。著名爱国侨领陈嘉庚先生得知祖国需要大量汽车司机和修理人员，发布南侨总会第六号通告，号召华侨中的年轻司机和技工回国服务，共拯危亡。",
      "马来西亚、新加坡、泰国、缅甸、越南、菲律宾、印度尼西亚、印度等国华侨热烈响应，3000多名南洋华侨机工于1939年分9批回到祖国参加抗日，在滇缅公路投入抗战运输工作，被称为“南洋华侨机工回国服务团”。",
      "当年回国服务的南侨机工共有三千多人。有一千多人因战火、车祸和疾病为国捐躯，另有一千多人在战后回到居住国，而剩下来的一千多人则一直留了下来"
    ]
  },
  "fields": {
    "人物": {
      "text": "陈嘉庚，南洋华侨领袖。",
      "evidence": "著名爱国侨领陈嘉庚先生得知祖国需要大量汽车司机和修理人员",
      "inferred": false
    },
    "时间": {
      "text": "1939年。",
      "evidence": "3000多名南洋华侨机工于1939年分9批回到祖国参加抗日",
      "inferred": false
    },
    "地点": {
      "text": "滇缅公路。",
      "evidence": "在滇缅公路投入抗战运输工作",
      "inferred": false
    },
    "起因": {
      "text": "滇缅公路修通后，熟练的司机和技工十分紧缺，陈嘉庚发出南侨总会第六号通告，号召华侨青年司机和技工回国。",
      "evidence": "滇缅公路修通后，熟练的司机和技工十分紧缺。著名爱国侨领陈嘉庚先生得知祖国需要大量汽车司机和修理人员，发布南侨总会第六号通告，号召华侨中的年轻司机和技工回国服务，共拯危亡。",
      "inferred": false
    },
    "经过": {
      "text": "马来西亚、新加坡等地华侨响应，三千多名机工于1939年分九批回国，在滇缅公路上运送抗战物资。",
      "evidence": "马来西亚、新加坡、泰国、缅甸、越南、菲律宾、印度尼西亚、印度等国华侨热烈响应，3000多名南洋华侨机工于1939年分9批回到祖国参加抗日",
      "inferred": false
    },
    "结果": {
      "text": "其中一千多人因战火、车祸和疾病丧生，一千多人在战后回到居住国。",
      "evidence": "有一千多人因战火、车祸和疾病为国捐躯，另有一千多人在战后回到居住国",
      "inferred": false
    }
  },
  "notes": "碑文为1985年云南省政府所立，属后世追述，但统计口径与当年档案互证；未采用文中的评价性表述。",
  "review": {
    "status": "draft",
    "by": null,
    "at": null
  }
}