{
  "id": "huaqiao-yayalai-neizhan-001",
  "title": "雪兰莪内战与吉隆坡失守",
  "source": {
    "work": "人民日报海外版《华裔叶亚来重建吉隆坡》（中国侨网转载）",
    "url": "https://www.chinaqw.com/zgqj/qsgc/200701/26/59284.shtml",
    "revision": "2007-01-26",
    "quotes": [
      "1870年，33岁的叶亚来出任吉隆坡第三任甲必丹。",
      "不过叶亚来的运气并不佳，就在他走马上任之际，正是当地土侯为争夺矿税而发生激烈内战的时候。",
      "从1870年至1873年的4年中，吉隆坡因此两次失守和三度被焚。1873年3月间，当叶亚来领兵结束内乱收复吉隆坡时，那里矿井倒塌、店铺遭劫、民居被焚、人心思散，已是一片废墟了。"
    ]
  },
  "fields": {
    "人物": {
      "text": "叶亚来，吉隆坡华人甲必丹。",
      "evidence": "叶亚来出任吉隆坡第三任甲必丹",
      "inferred": false
    },
    "时间": {
      "text": "1870年至1873年。",
      "evidence": "从1870年至1873年的4年中",
      "inferred": false
    },
    "地点": {
      "text": "吉隆坡。",
      "evidence": "吉隆坡因此两次失守和三度被焚",
      "inferred": false
    },
    "起因": {
      "text": "当地土侯为争夺矿税发生激烈内战。",
      "evidence": "正是当地土侯为争夺矿税而发生激烈内战的时候",
      "inferred": false
    },
    "经过": {
      "text": "四年之内，吉隆坡两次失守、三次被焚。",
      "evidence": "吉隆坡因此两次失守和三度被焚",
      "inferred": false
    },
    "结果": {
      "text": "1873年3月，叶亚来领兵收复吉隆坡，城中已是一片废墟。",
      "evidence": "1873年3月间，当叶亚来领兵结束内乱收复吉隆坡时，那里矿井倒塌、店铺遭劫、民居被焚、人心思散，已是一片废墟了",
      "inferred": false
    }
  },
  "notes": "甲必丹就任年份另有 1869 年一说（百度百科年谱），本文取 1870 年。",
  "review": {
    "status": "draft",
    "by": null,
    "at": null
  }
}